{
  "schemaVersion" : "matching.m11.mutants.v1",
  "status" : "PASS",
  "required" : 10,
  "killed" : 10,
  "classification" : "STUDENT_FAILURE",
  "executableCandidates" : 10,
  "systemErrorControls" : 3,
  "systemErrorsObserved" : 3,
  "systemErrorCountedAsKill" : false,
  "counterexampleSha256" : "bd14422bedc830ab9d63fb2441d2e18aa5d48da61c3aaea3cefc669e3397786d",
  "counterexampleCanonicalSha256" : "30bfdad011b7460838e8b3166053429ef9ac1d20d197f76fa21496cc5f3ec23a",
  "productionControlsPassed" : 10,
  "serializedFreshReplays" : 10,
  "serializedReplayFingerprintsExact" : true,
  "oneMinimalCounterexamples" : 10,
  "actualMutationActions" : 14,
  "rawActions" : 45,
  "minimalActions" : 23,
  "shrinkTrials" : 68,
  "candidates" : [ {
    "id" : "M11-OFFER-AS-SUCCESS",
    "productionClassification" : "PASS",
    "classification" : "STUDENT_FAILURE",
    "fingerprint" : "INGRESS_OFFER_UPGRADED_TO_BUSINESS_SUCCESS",
    "candidateDriver" : "FRESH_PRODUCTION_DERIVED_SINGLE_FAULT_MACHINE",
    "observer" : "M11_UNIFIED_TYPED_TRACE_OBSERVER_V2",
    "freshProductionControl" : true,
    "singleFaultMode" : "OFFER_AS_SUCCESS",
    "actualMutationActions" : 1,
    "systemErrorCountedAsKill" : false,
    "counterexampleId" : "cex-m11-offer-as-success"
  }, {
    "id" : "M11-SESSION-AS-IDENTITY",
    "productionClassification" : "PASS",
    "classification" : "STUDENT_FAILURE",
    "fingerprint" : "SESSION_CHANGED_BUSINESS_IDENTITY",
    "candidateDriver" : "FRESH_PRODUCTION_DERIVED_SINGLE_FAULT_MACHINE",
    "observer" : "M11_UNIFIED_TYPED_TRACE_OBSERVER_V2",
    "freshProductionControl" : true,
    "singleFaultMode" : "SESSION_AS_IDENTITY",
    "actualMutationActions" : 2,
    "systemErrorCountedAsKill" : false,
    "counterexampleId" : "cex-m11-session-as-identity"
  }, {
    "id" : "M11-CORRELATION-AS-IDENTITY",
    "productionClassification" : "PASS",
    "classification" : "STUDENT_FAILURE",
    "fingerprint" : "CORRELATION_CHANGED_BUSINESS_IDENTITY",
    "candidateDriver" : "FRESH_PRODUCTION_DERIVED_SINGLE_FAULT_MACHINE",
    "observer" : "M11_UNIFIED_TYPED_TRACE_OBSERVER_V2",
    "freshProductionControl" : true,
    "singleFaultMode" : "CORRELATION_AS_IDENTITY",
    "actualMutationActions" : 2,
    "systemErrorCountedAsKill" : false,
    "counterexampleId" : "cex-m11-correlation-as-identity"
  }, {
    "id" : "M11-RESPOND-BEFORE-BIND",
    "productionClassification" : "PASS",
    "classification" : "STUDENT_FAILURE",
    "fingerprint" : "RESPONSE_OBSERVED_BEFORE_RESULT_BIND",
    "candidateDriver" : "FRESH_PRODUCTION_DERIVED_SINGLE_FAULT_MACHINE",
    "observer" : "M11_UNIFIED_TYPED_TRACE_OBSERVER_V2",
    "freshProductionControl" : true,
    "singleFaultMode" : "RESPOND_BEFORE_BIND",
    "actualMutationActions" : 2,
    "systemErrorCountedAsKill" : false,
    "counterexampleId" : "cex-m11-respond-before-bind"
  }, {
    "id" : "M11-DROP-IDENTITY-FROM-SNAPSHOT",
    "productionClassification" : "PASS",
    "classification" : "STUDENT_FAILURE",
    "fingerprint" : "SNAPSHOT_LOST_IDEMPOTENCY_TABLE",
    "candidateDriver" : "FRESH_PRODUCTION_DERIVED_SINGLE_FAULT_MACHINE",
    "observer" : "M11_UNIFIED_TYPED_TRACE_OBSERVER_V2",
    "freshProductionControl" : true,
    "singleFaultMode" : "DROP_IDENTITY_FROM_SNAPSHOT",
    "actualMutationActions" : 1,
    "systemErrorCountedAsKill" : false,
    "counterexampleId" : "cex-m11-drop-identity-from-snapshot"
  }, {
    "id" : "M11-CORRUPT-SNAPSHOT-TO-GENESIS",
    "productionClassification" : "PASS",
    "classification" : "STUDENT_FAILURE",
    "fingerprint" : "CORRUPT_SNAPSHOT_SILENTLY_BECAME_GENESIS",
    "candidateDriver" : "FRESH_PRODUCTION_DERIVED_SINGLE_FAULT_MACHINE",
    "observer" : "M11_UNIFIED_TYPED_TRACE_OBSERVER_V2",
    "freshProductionControl" : true,
    "singleFaultMode" : "CORRUPT_SNAPSHOT_TO_GENESIS",
    "actualMutationActions" : 1,
    "systemErrorCountedAsKill" : false,
    "counterexampleId" : "cex-m11-corrupt-snapshot-to-genesis"
  }, {
    "id" : "M11-REJECT-N-MINUS-ONE",
    "productionClassification" : "PASS",
    "classification" : "STUDENT_FAILURE",
    "fingerprint" : "N_MINUS_ONE_COMPATIBILITY_REJECTED",
    "candidateDriver" : "FRESH_PRODUCTION_DERIVED_SINGLE_FAULT_MACHINE",
    "observer" : "M11_UNIFIED_TYPED_TRACE_OBSERVER_V2",
    "freshProductionControl" : true,
    "singleFaultMode" : "REJECT_N_MINUS_ONE",
    "actualMutationActions" : 1,
    "systemErrorCountedAsKill" : false,
    "counterexampleId" : "cex-m11-reject-n-minus-one"
  }, {
    "id" : "M11-INCLUDE-RUNTIME-METADATA-IN-DIGEST",
    "productionClassification" : "PASS",
    "classification" : "STUDENT_FAILURE",
    "fingerprint" : "RUNTIME_METADATA_CHANGED_BUSINESS_DIGEST",
    "candidateDriver" : "FRESH_PRODUCTION_DERIVED_SINGLE_FAULT_MACHINE",
    "observer" : "M11_UNIFIED_TYPED_TRACE_OBSERVER_V2",
    "freshProductionControl" : true,
    "singleFaultMode" : "INCLUDE_RUNTIME_METADATA_IN_DIGEST",
    "actualMutationActions" : 2,
    "systemErrorCountedAsKill" : false,
    "counterexampleId" : "cex-m11-include-runtime-metadata-in-digest"
  }, {
    "id" : "M11-DOUBLE-WRITE-LOCAL-WAL",
    "productionClassification" : "PASS",
    "classification" : "STUDENT_FAILURE",
    "fingerprint" : "CLUSTER_SERVICE_WROTE_STANDALONE_WAL",
    "candidateDriver" : "FRESH_PRODUCTION_DERIVED_SINGLE_FAULT_MACHINE",
    "observer" : "M11_UNIFIED_TYPED_TRACE_OBSERVER_V2",
    "freshProductionControl" : true,
    "singleFaultMode" : "DOUBLE_WRITE_LOCAL_WAL",
    "actualMutationActions" : 1,
    "systemErrorCountedAsKill" : false,
    "counterexampleId" : "cex-m11-double-write-local-wal"
  }, {
    "id" : "M11-ACCEPT-UNSUPPORTED-VERSION",
    "productionClassification" : "PASS",
    "classification" : "STUDENT_FAILURE",
    "fingerprint" : "UNSUPPORTED_VERSION_ACCEPTED",
    "candidateDriver" : "FRESH_PRODUCTION_DERIVED_SINGLE_FAULT_MACHINE",
    "observer" : "M11_UNIFIED_TYPED_TRACE_OBSERVER_V2",
    "freshProductionControl" : true,
    "singleFaultMode" : "ACCEPT_UNSUPPORTED_VERSION",
    "actualMutationActions" : 1,
    "systemErrorCountedAsKill" : false,
    "counterexampleId" : "cex-m11-accept-unsupported-version"
  } ],
  "controls" : [ {
    "id" : "M11-THROWING-CODEC-CONTROL",
    "classification" : "SYSTEM_ERROR",
    "classifier" : "M11_SHARED_FAILURE_CLASSIFIER_V1",
    "executedPath" : "REQUEST_CODEC_COMPONENT",
    "failureType" : "IllegalStateException",
    "countedAsKill" : false
  }, {
    "id" : "M11-CLUSTER-STARTUP-CONTROL",
    "classification" : "SYSTEM_ERROR",
    "classifier" : "M11_SHARED_FAILURE_CLASSIFIER_V1",
    "executedPath" : "SINGLE_NODE_CLUSTER_LAUNCHER",
    "failureType" : "IllegalStateException",
    "countedAsKill" : false
  }, {
    "id" : "M11-CORRUPT-HARNESS-OUTPUT-CONTROL",
    "classification" : "SYSTEM_ERROR",
    "classifier" : "M11_SHARED_FAILURE_CLASSIFIER_V1",
    "executedPath" : "HARNESS_REPORT_PARSER",
    "failureType" : "FixtureSchemaException",
    "countedAsKill" : false
  } ]
}
